{
  "type": "object",
  "properties": {
    "schema": {
      "type": "string",
      "const": "math_quality_report/1"
    },
    "passed": {
      "type": "boolean"
    },
    "checks": {
      "type": "array",
      "items": {
        "type": "object",
        "properties": {
          "check_id": {
            "type": "string",
            "minLength": 1
          },
          "category": {
            "type": "string",
            "enum": [
              "schema",
              "source_fidelity",
              "conceptual_clarity",
              "intuition",
              "logicality",
              "mathematical_correctness",
              "user_readability"
            ]
          },
          "severity": {
            "type": "string",
            "enum": [
              "error",
              "warning",
              "info"
            ]
          },
          "passed": {
            "type": "boolean"
          },
          "message": {
            "type": "string",
            "minLength": 1
          },
          "targets": {
            "type": "array",
            "items": {
              "type": "string"
            }
          },
          "origin": {
            "type": "string",
            "enum": [
              "deterministic",
              "reviewer",
              "guard"
            ]
          }
        },
        "required": [
          "check_id",
          "category",
          "severity",
          "passed",
          "message",
          "targets",
          "origin"
        ],
        "additionalProperties": false
      }
    },
    "summary": {
      "type": "object",
      "properties": {
        "errors": {
          "type": "integer",
          "minimum": 0
        },
        "warnings": {
          "type": "integer",
          "minimum": 0
        },
        "infos": {
          "type": "integer",
          "minimum": 0
        }
      },
      "required": [
        "errors",
        "warnings",
        "infos"
      ],
      "additionalProperties": false
    }
  },
  "required": [
    "schema",
    "passed",
    "checks",
    "summary"
  ],
  "additionalProperties": false,
  "$schema": "https://json-schema.org/draft/2020-12/schema",
  "$id": "urn:math-study-agent:schema:math_quality_report:v1",
  "title": "math_quality_report/1"
}
