{
  "schema": "math_quality_report/1",
  "passed": true,
  "checks": [
    {
      "check_id": "SF1.professor_attribution",
      "category": "source_fidelity",
      "severity": "error",
      "passed": true,
      "message": "C2.professor[5]: 교수님 관련 서술은 검증된 교수님 자료(P id)를 근거로 가져야 함",
      "targets": [
        "C2.professor[5]"
      ],
      "origin": "deterministic"
    },
    {
      "check_id": "SF2.reconstruction_scope",
      "category": "source_fidelity",
      "severity": "error",
      "passed": true,
      "message": "C2.professor[5]: 교수님 설명 재구성은 P 근거가 있는 교수님 강조 상자에만 쓸 수 있음",
      "targets": [
        "C2.professor[5]"
      ],
      "origin": "deterministic"
    },
    {
      "check_id": "SF1.professor_attribution",
      "category": "source_fidelity",
      "severity": "error",
      "passed": true,
      "message": "C3.professor[7]: 교수님 관련 서술은 검증된 교수님 자료(P id)를 근거로 가져야 함",
      "targets": [
        "C3.professor[7]"
      ],
      "origin": "deterministic"
    },
    {
      "check_id": "SF2.reconstruction_scope",
      "category": "source_fidelity",
      "severity": "error",
      "passed": true,
      "message": "C3.professor[7]: 교수님 설명 재구성은 P 근거가 있는 교수님 강조 상자에만 쓸 수 있음",
      "targets": [
        "C3.professor[7]"
      ],
      "origin": "deterministic"
    },
    {
      "check_id": "SF1.professor_attribution",
      "category": "source_fidelity",
      "severity": "error",
      "passed": true,
      "message": "C4.professor[1]: 교수님 관련 서술은 검증된 교수님 자료(P id)를 근거로 가져야 함",
      "targets": [
        "C4.professor[1]"
      ],
      "origin": "deterministic"
    },
    {
      "check_id": "SF3.uncertainties_surfaced",
      "category": "source_fidelity",
      "severity": "warning",
      "passed": true,
      "message": "자료의 불확실한 부분이 노트에 드러나야 함",
      "targets": [],
      "origin": "deterministic"
    },
    {
      "check_id": "CC1.core_depth",
      "category": "conceptual_clarity",
      "severity": "error",
      "passed": true,
      "message": "C2: 핵심 개념은 depth=full",
      "targets": [
        "C2"
      ],
      "origin": "deterministic"
    },
    {
      "check_id": "IN1.why_present",
      "category": "intuition",
      "severity": "warning",
      "passed": true,
      "message": "C2: '왜 배우는가' 보조 설명이 있으면 좋음",
      "targets": [
        "C2"
      ],
      "origin": "deterministic"
    },
    {
      "check_id": "CC1.core_depth",
      "category": "conceptual_clarity",
      "severity": "error",
      "passed": true,
      "message": "C3: 핵심 개념은 depth=full",
      "targets": [
        "C3"
      ],
      "origin": "deterministic"
    },
    {
      "check_id": "IN1.why_present",
      "category": "intuition",
      "severity": "warning",
      "passed": true,
      "message": "C3: '왜 배우는가' 보조 설명이 있으면 좋음",
      "targets": [
        "C3"
      ],
      "origin": "deterministic"
    },
    {
      "check_id": "CC2.main_content_first",
      "category": "conceptual_clarity",
      "severity": "error",
      "passed": true,
      "message": "C1: 핵심 내용이 먼저 나옴",
      "targets": [
        "C1"
      ],
      "origin": "deterministic"
    },
    {
      "check_id": "CC2.main_content_first",
      "category": "conceptual_clarity",
      "severity": "error",
      "passed": true,
      "message": "C2: 핵심 내용이 먼저 나옴",
      "targets": [
        "C2"
      ],
      "origin": "deterministic"
    },
    {
      "check_id": "CC2.main_content_first",
      "category": "conceptual_clarity",
      "severity": "error",
      "passed": true,
      "message": "C3: 핵심 내용이 먼저 나옴",
      "targets": [
        "C3"
      ],
      "origin": "deterministic"
    },
    {
      "check_id": "CC2.main_content_first",
      "category": "conceptual_clarity",
      "severity": "error",
      "passed": true,
      "message": "C4: 핵심 내용이 먼저 나옴",
      "targets": [
        "C4"
      ],
      "origin": "deterministic"
    },
    {
      "check_id": "CC3.all_concepts_present",
      "category": "conceptual_clarity",
      "severity": "warning",
      "passed": true,
      "message": "모든 개념이 노트에 등장해야 함",
      "targets": [],
      "origin": "deterministic"
    },
    {
      "check_id": "PR1.theorem_has_proof",
      "category": "logicality",
      "severity": "warning",
      "passed": true,
      "message": "C2.theorem[1]: 정리 뒤에 증명이 있어야 함",
      "targets": [
        "C2.theorem[1]"
      ],
      "origin": "deterministic"
    },
    {
      "check_id": "PR1.theorem_has_proof",
      "category": "logicality",
      "severity": "warning",
      "passed": true,
      "message": "C3.theorem[1]: 정리 뒤에 증명이 있어야 함",
      "targets": [
        "C3.theorem[1]"
      ],
      "origin": "deterministic"
    },
    {
      "check_id": "LG1.prerequisite_order",
      "category": "logicality",
      "severity": "error",
      "passed": true,
      "message": "선수 개념이 먼저 설명되어야 함",
      "targets": [],
      "origin": "deterministic"
    },
    {
      "check_id": "LG2.follows_learning_flow",
      "category": "logicality",
      "severity": "warning",
      "passed": true,
      "message": "노트 순서가 Concept Map의 learning_flow와 다름",
      "targets": [
        "C1",
        "C2",
        "C3",
        "C4"
      ],
      "origin": "deterministic"
    },
    {
      "check_id": "EX1.exam_problems",
      "category": "user_readability",
      "severity": "warning",
      "passed": true,
      "message": "시험 대비 예상 문제가 있어야 함",
      "targets": [
        "exam"
      ],
      "origin": "deterministic"
    },
    {
      "check_id": "UR1.sentence_length",
      "category": "user_readability",
      "severity": "warning",
      "passed": true,
      "message": "C1: 평균 문장 길이 25자 (권장 90자 이하)",
      "targets": [
        "C1"
      ],
      "origin": "deterministic"
    },
    {
      "check_id": "UR2.brief_is_brief",
      "category": "user_readability",
      "severity": "warning",
      "passed": true,
      "message": "C1: 보조 개념에 상자가 4개 (과도한 분할)",
      "targets": [
        "C1"
      ],
      "origin": "deterministic"
    },
    {
      "check_id": "UR1.sentence_length",
      "category": "user_readability",
      "severity": "warning",
      "passed": true,
      "message": "C2: 평균 문장 길이 26자 (권장 90자 이하)",
      "targets": [
        "C2"
      ],
      "origin": "deterministic"
    },
    {
      "check_id": "UR1.sentence_length",
      "category": "user_readability",
      "severity": "warning",
      "passed": true,
      "message": "C3: 평균 문장 길이 30자 (권장 90자 이하)",
      "targets": [
        "C3"
      ],
      "origin": "deterministic"
    },
    {
      "check_id": "UR1.sentence_length",
      "category": "user_readability",
      "severity": "warning",
      "passed": true,
      "message": "C4: 평균 문장 길이 35자 (권장 90자 이하)",
      "targets": [
        "C4"
      ],
      "origin": "deterministic"
    },
    {
      "check_id": "UR2.brief_is_brief",
      "category": "user_readability",
      "severity": "warning",
      "passed": true,
      "message": "C4: 보조 개념에 상자가 4개 (과도한 분할)",
      "targets": [
        "C4"
      ],
      "origin": "deterministic"
    },
    {
      "check_id": "UR3.latex_well_formed",
      "category": "user_readability",
      "severity": "error",
      "passed": true,
      "message": "LaTeX 구조 이상 없음",
      "targets": [],
      "origin": "deterministic"
    },
    {
      "check_id": "FG1.figures_valid",
      "category": "mathematical_correctness",
      "severity": "error",
      "passed": true,
      "message": "그림 데이터 이상 없음",
      "targets": [],
      "origin": "deterministic"
    },
    {
      "check_id": "RV.user_readability",
      "category": "user_readability",
      "severity": "info",
      "passed": true,
      "message": "C3의 '직관적으로 이해하기' 섹션이 다른 섹션보다 길다. → 정리(T2) 인용 부분을 짧게 줄이면 흐름이 더 가벼워진다.",
      "targets": [
        "C3.intuition"
      ],
      "origin": "reviewer"
    }
  ],
  "summary": {
    "errors": 0,
    "warnings": 0,
    "infos": 1
  }
}
